doi,title,abstract,label_included
https://doi.org/10.1159/000492737,"Jahrestagung der Deutschen, Österreichischen und Schweizerischen Gesellschaften für Hämatologie und Medizinische Onkologie, Wien, 28. September - 2. Oktober 2018: Abstracts","Acquired hemophilia A (AHA) is an autoimmune disease, caused by antibodies blocking the function of coagulation factor VIII. The incidence is 1.5/million/year. In half of the patients an underlying disorder (malignancy, pregnancy, drugs, other autoimmune diseases) is associated with AHA. New onset of bleeding (skin hematomas, deep muscle or retroperitoneal hematomas, mucosal bleeding) often leads to further investigations and the diagnosis of AHA. A prolongation of the APTT, without correction in mixing studies, and low FVIII levels confirm the diagnosis. Bleeding is severe in most of the patients and hemostatic therapy is necessary. As human factor VIII replacement is insufficient at high inhibitor titers, bypassing agents (recombinant factor VIIa, activated prothrombin complex concentrates) or recombinant porcine FVIII are necessary to stop bleeding. New strategies, as emicizumab, are currently under investigation. Although spontaneous remissions can occur, immunosuppression (steroids, cyclophosphamides, rituximab) is necessary to eradicate the inhibitor and improve survival, but may cause severe side effects. As clinical trials in this rare and heterogeneous disease are difficult, current evidence comes from registries and case series. The European Acquired Hemophilia Registry (EACH2) is the largest prospective collection of patients with AHA (n = 501) and provides deeper insight demographics, underlying disorders, management of bleeding and immunosuppression, and outcome. In the GTH AH-01/2012 trial 124 patients with AHA were treated with a standardized immunosuppression protocol in order to analyze response, adverse events and outcome. The results of both trials show a high efficacy of bypassing agents to stop bleeding, and the need to eradicate the inhibitor to improve survival.",0
https://doi.org/10.1182/blood.v130.suppl_1.3658.3658,Increasing of Ternary Complex Formation By Predominant Accumulation of Factor (F)X Accompanied By Increase of Fixa Contributes to Enhancement of Clotting Function By Apcc in Combination with Emicizumab,"Background: Emicizumab is a novel therapeutic bispecific antibody for treatment of patients with hemophilia A (PWHA) irrespective of FVIII inhibitors. In the phase 3 clinical study of emicizumab focusing on PWHA with inhibitor (-inh) over 12 years old (NEJM2017), several thromboembolic events were reported among participants after multiple infusions of activated prothrombin complex concentrate (APCC) for breakthrough bleeding. We recently reported that the global hemostatic function evaluated by ROTEM was additively enhanced by infusion of APCC under treatment of emicizumab in the Japanese phase 1/2 study (ISTH2017). There exist three forms of emicizumab in the circulating plasma such as i) monomer, ii) binary complex with either FIX(a) or FX, and iii) ternary complex with FIX(a) and FX. According to in vitro experiments, we recently demonstrated that the percent of the ternary complex would be predicted by KD -based simulation based on concentration of emicizumab, FIX(a) and FX (Thromb Haemost. 2017). The in vivo pharmacodynamics of FIX(a) and FX after infusion of APCC in the presence of emicizumab are to be elucidated for confirmation of safety. Aim: To clarify the relationship between pharmacodynamics of FIX(a) and FX after infusion(s) of APCC and hemostatic potential in the presence of emicizumab. Methods: We first examined the hemostatic function by addition of emicizumab (0, 10, 50, 100μg/ml) in the citrated blood samples obtained from seven PWHAs-inh (who do not participate in the clinical study) received APCC (80-100U/kg) by thrombin generation assay (TGA) using tissue factor (0.5pM) and ellagic acid (0.3µM) as trigger reagents. The plasma samples were classified by APCC-dosing at collection as summarized in Table. Class A was defined as single or prophylactic administration while class B was defined as treatment with multiple administrations. For patient 7, intra-individual evaluation was examined before (as class A) and after initiation of treatment by APCC (as class B). We further confirmed the in vivo additional effect by APCC to emicizumab in the samples obtained from one PWHA-inh (patient 8) enrolled in the Japanese phase 1/2 study. This patient received four multiple infusions of APCC (~50U/kg, every 12hr) for a major bleeding. Results: Spike of emicizumab in vitro exhibited a dose-dependent modest increase of PeakTh maximally by ~1.6-fold of that in the absence of emicizumab (212 ± 22.8 nM) in class A. On the other hand in class B, PeakTh augmented dose-dependently on emicizumab (max. to 1,538 ± 38 nM by ~12.5-fold of that in its absence) far beyond normal control (382 nM). As for the samples from patient 8, PeakTh increased from 80.6 nM to 240 nM after 4th infusion of APCC. This increase of PeakTh was less than that in class B (from 122 ± 9.73 nM to 793 ± 29.3 nM) after spike of emicizumab (10µg/ml) which is equivalent to the target concentration in patient 8. To identify the determinant of these different hemostatic enhancing effects, antigen (Ag) levels of FX and FIX(a) in the plasmas were measured by ELISAs. The median values of FX:Ag and FIX(a):Ag were 424nM (~3.1-fold of normal control) and 124nM (~1.4-fold of normal) in class A, and those in class B were 2,000nM (~15-fold of normal) and 278nM (~3-fold of normal), respectively. In the samples of patient 8 from the Japanese phase 1/2 study, FX:Ag increased up to 3.7-fold of normal after 1st administration of APCC and further increased to 7-fold of normal after 4th administration, while FIX(a):Ag was little affected by administrations of APCC different from class B, which would be attributed to that the lower dose of APCC were infused for patient 8 than that for patients in class B. Taken together, dose and/or frequency of APCC infusion(s) seemed to affect the pharmacodynamics of FIX(a) and FX in the plasma. The elevation of both of them, especially FX, resulting in the increase of ternary complex in the presence of emicizumab, contribute to hemostatic enhancement. Conclusion: In conclusion, high-dose and frequent infusions of APCC contribute to the predominant accumulation of FX accompanied by the increase of FIX(a) in the plasma enhancing the hemostatic effect in the presence of emicizumab, in addition to the bypassing reactions. Disclosures Yada: Chugai Pharmaceutical Co.: Research Funding. Nogami: Roche: Honoraria, Membership on an entity9s Board of Directors or advisory committees; Chugai Pharmaceutical Co.: Honoraria, Membership on an entity9s Board of Directors or advisory committees, Research Funding. Matsumoto: Chugai Pharmaceutical Co.: Research Funding. Kitazawa: Chugai Pharmaceutical Co.: Employment, Equity Ownership, Patents & Royalties. Shima: Chugai Pharmaceutical Co.: Consultancy, Honoraria, Research Funding; Roche: Consultancy, Honoraria, Membership on an entity9s Board of Directors or advisory committees.",0
https://doi.org/10.1358/dot.2018.54.10.2869771,Emicizumab for routine prophylaxis to prevent bleeding episodes in patients with hemophilia A,"Hemophilia A is an X-linked bleeding disorder caused by defects in the gene encoding factor VIII (FVIII). Routine prophylaxis with exogenous FVIII requires frequent intravenous injections. One of the most challenging issues in the treatment of hemophilia A is the development of alloantibodies against infused FVIII. Presence of inhibitors results in an ineffective factor replacement therapy and increases the risk of morbidity and mortality in these patients. Therefore, there is growing interest in the development of new strategies for the prophylaxis and prevention of bleeding in patients with hemophilia to circumvent these drawbacks. Emicizumab (ACE-910; Roche, Genentech and Chugai Pharmaceutical) is a recombinant humanized bispecific antibody that restores the function of missing FVIII by bridging activated FIX and FX, simulating the cofactor function of FVIII.",0
https://doi.org/10.1080/14712598.2019.1626370,Emicizumab for the prevention of bleeds in hemophilia A,"Introduction: The management of hemophilia A with and without inhibitors is challenging with high treatment burden of prophylactic regimens, musculoskeletal complications, poor treatment compliance, poor venous access and therapies with suboptimal levels. Areas covered: Emicizumab is a bispecific monoclonal antibody recently approved for prevention of bleeds in hemophilia A patients with and without inhibitors. This review is a synthesis of several recently completed emicizumab clinical trials with the emphasis of its mechanism of action, efficacy, safety, and pharmacokinetic profile when used for prevention of bleeds in hemophilia A patients of all age groups with and without inhibitors. We also review the role of emicizumab in the era of rapidly evolving novel therapies in hemophilia A. Expert opinion: Data from completed clinical studies indicate that emicizumab is poised to address current unmet needs in hemophilia A. It has high efficacy in the prevention of bleeds and a favorable safety profile. Subcutaneous dosing and versatile dosing regimens make emicizumab an ideal drug to address current unmet needs in hemophilia A management across all age groups. How emicizumab fits in the current rapidly evolving hemophilia A therapeutic landscape will be exciting to watch in the coming period.",0
https://doi.org/10.1080/13543784.2020.1722999,Investigational drugs to treat hemophilia,"Introduction: Hemophilia A and B are congenital bleeding disorders. The current standard management of patients with severe hemophilia is prophylaxis which is given intravenously two or three times weekly; however, this is associated with a significant burden on the quality of life of the patient. The main attempts to improve the management of hemophilia is hence through the development of a new generation of products with properties facilitating prophylaxis and/or a better control of bleeding.Areas covered: This review describes the preclinical and phase 1/2 studies investigating the innovative products for the management of hemophilia patients with or without coagulation factor inhibitors.Expert opinion: Numerous innovative therapeutics, including factor concentrates and non-clotting factor-based therapies with extended half-life, are under clinical investigation. Among replacement therapies for hemophilia A, the results from phase 1/2 studies indicate that the most interesting products are those bioengineered using XTEN fusion technology. The anti-tissue factor pathway inhibitor antibody concizumab is the most innovative and interesting agent among non-clotting factor products. If the results of ongoing trials confirm the preliminary positive results, these promising agents will provide further improvements in the management and quality of life of patients with hemophilia.",0
https://doi.org/10.1016/j.xphs.2018.12.014,Immunogenicity of Protein Pharmaceuticals,"Protein therapeutics have drastically changed the landscape of treatment for many diseases by providing a regimen that is highly specific and lacks many off-target toxicities. The clinical utility of many therapeutic proteins has been undermined by the potential development of unwanted immune responses against the protein, limiting their efficacy and negatively impacting its safety profile. This review attempts to provide an overview of immunogenicity of therapeutic proteins, including immune mechanisms and factors influencing immunogenicity, impact of immunogenicity, preclinical screening methods, and strategies to mitigate immunogenicity.",0
https://doi.org/10.1016/j.blre.2020.100737,"The evolving landscape of gene therapy for congenital haemophilia: An unprecedented, problematic but promising opportunity for worldwide clinical studies","Abstract With liver-directed gene therapy, congenital haemophilia has the potential to progress from an incurable to a phenotypically curable condition. However, the proportion of haemophilia population likely to benefit from gene therapy remains to be established. Achieving a phenotypic curative goal is presently hampered by: 1) availability of effective treatments (e.g. extended half-life products, non-factor therapies) that address major unmet needs in haemophilia; 2) key differences between hope and reality that patients undergoing gene therapy face (e.g. unknown risks and long-term follow-up, durability of the therapeutic effect, possibility of re-administering the vector), 3) lack of expertise of health care professionals (HCP) in managing/monitoring unexpected side effects in patients, and 4) lack of expertise of HCP in advising payers on key issues for cost-effectiveness analyses of gene therapy (e.g., eligibility criteria, predictability of response, unknown risks, long-term complications). There is also uncertainty about the possibility to absorb the cost of the “one-time, one-dose cure” by payers that are used to different payment models. An active partnership between regulators, payers, patients and health care professionals is key to identify patient sub-populations that might benefit the most from gene therapy, and to align the interests of patients (needing effective disease correction and improved quality of life) and pharma companies (reluctant to lose the profitability of lifelong repeated treatments). Educational programs will provide the healthcare chain with information on the strategy that is expected to transform morbidity and mortality patterns and how it should be regarded as part of the future therapeutic options in haemophilia.",0
https://doi.org/10.1002/rth2.12227,Nurses and Orals Abstracts,"Background : Emicizumab is a subcutaneously administered, bispecific monoclonal antibody that restores haemostasis in PwHA. Aims : To present the long- term efficacy and safety of emicizumab in PwHA across the four phase III studies: HAVEN 1 (NCT02622321), 2 (NCT02795767), 3 (NCT02847637), and 4 (NCT03020160). Methods : The studies enrolled paediatric (< 12 years old) and adolescent/ adult (≥12 years old) PwHA, with or without FVIII inhibitors. Emicizumab prophylaxis was administered 1.5 mg/kg weekly, 3 mg/ kg every 2 weeks, or 6 mg/kg every 4 weeks. All participants assigned to receive emicizumab were included, and data analysed by study or pooled across studies. Results : Overall, 400 participants in HAVEN 1, 2, 3, and 4 (n=113, 88, 151, and 48, respectively) were included in the efficacy analysis, with a median efficacy period of 82.4 weeks (with 77% of participants treated for ≥74 weeks). The model- based annualized treated bleed rate (ABR; derived via negative binomial regression) was 1.5 (95% CI 1.20- 1.84). The mean ABR decreased across consecutive 24- week treatment intervals (Table 1). Across studies, over 87% of participants had no treated joint bleeds in each interval from Week 25 and over 92% had no spontaneous bleeds (Figure 1). No death, thrombotic, or thrombotic microangiopathy events occurred in these trials beyond those reported in HAVEN 1 at the respective primary analysis (Oldenburg et al. NEJM, 2017). Emicizumab continued to be well tolerated, with no participants discontinuing due to adverse events beyond the five previously described (Oldenburg et al. NEJM, 2017; Young et al. ASH, 2018; Mahlangu et al. NEJM, 2018; Pipe et al. WFH 2018). Conclusions : Emicizumab maintained low bleed rates and favourable safety and tolerability in PwHA of all ages, with or without FVIII inhibitors. Mean ABR decreased and the proportion of participants with zero joint or spontaneous bleeds increased across each treatment interval from Week 25. (Table Presented).",0
https://doi.org/10.1111/j.1365-2516.2011.02539.x,Clinical severity of haemophilia A: does the classification of the 1950s still stand?,"Summary. The classification of haemophilia originates from 1950s and has been adopted unchallengedly by the ISTH in 2001. The aim of this study was: does the current classification compare onset of bleeding and age at first treatment, as well as annual joint bleeding frequency according to baseline FVIII activity? Data on age and reason of diagnosis, onset of treatment, onset of bleeding and bleeding frequency from 411 patients with haemophilia A born after 1970 were collected. Data were analysed according to base-line FVIII activity levels. Age at diagnosis, onset of bleeding and start of treatment according to FVIII activity were compared with the current classification. Overall, the distinction between severe and non-severe haemophilia was clear. The distinction between mild and moderate haemophilia was more difficult, mostly due to the wide variability in the group of patients with moderate haemophilia. Patients with severe haemophilia experienced their milestones like diagnosis, first treatment and joint bleed earliest, mostly as infants aged 0–3 years, whereas patients with moderate haemophilia reached these milestones around toddler age, 2–7 years, and patients with mild haemophilia reached them when they were in elementary school, around the ages of 5–14 years. This study confirms the clinical distinction between severe and non-severe haemophilia A. However, the group of moderate haemophilia patients showed a wide variability, warranting close follow-up and individualized treatment.",0
https://doi.org/10.2450/2017.s4,"XVI Convegno Triennale sui Problemi Clinici e Sociali dell'Emofilia e delle Malattie Emorragiche Congenite, Napoli, 9-12 Novembre 2017.","In the last decades, research lines for hemophilia treatment have been mainly focused on relieving patients of burdensome repeated factor infusions and improving compliance. The recent introduction in the clinical practice of extended halflife factor (F)VIII and IX products represent one step forward into this direction. Furthermore, recent reports of successful gene therapy and partial correction of the bleeding phenotype have raised the level of expectations for both hemophilia A and B. At the same time, a number of novel approaches not based on the replacement of the missing factor have also been investigated, with the goal of producing therapeutic agents equally effective in patients with or without inhibitors. These new strategies enhance the hemostatic potential mainly by bypassing the need of FVIII in tenase formation or quenching anticoagulant pathways. This presentation reviews human clinical trial progress concerning a recombinant bispecific IgG antibody to factors IXa and X that mimics FVIII cofactor activity (ACE910-Emicizumab), as well as an anti-TFPI monoclonal antibody (Concizumab) and a short interfering RNA designed to suppress liver production of antithrombin (ALN-AT3). For all these approaches, pharmacokinetic and pharmacodinamic studies have shown a prolonged effect following subcutaneous administration, therefore, confirming the potential for bleeding prevention with less demanding regimens in inhibitor and noninhibitor patients. Due to the mechanisms of action of these agents, thrombotic risk is the major concern. However, the safety profile may vary based on the specific drug and the different regimens. Safety data currently available are also reviewed in this presentation, although they should be considered with caution being still preliminary and referred to a limited follow-up period.",0
https://doi.org/10.1111/hae.13478,Abstracts,HemAcure: Application of combined gene and cell therapy within an implantable therapeutic device for the treatment of severe haemophilia A,0
https://doi.org/10.1002/cpt.310,American Society for Clinical Pharmacology and Therapeutics,"BACKGROUND: ACE910 is a humanized bispecific antibody that binds to coagulation factors IXa and X, thereby mimicking the cofactor function of coagulation factor VIII (FVIII). Once-weekly subcutaneous (SC) doses of 0.3, 1 and 3 mg/ kg reduced the annualized bleeding rate by 22.8% to 100% compared with historical data in severe hemophilia A patients with or without FVIII inhibitors. Repeated time-to-event (RTTE) modeling was conducted to explore the relationship between ACE910 pharmacokinetics (PK) and bleeding frequency. METHODS: Phase I and Phase I/II (ongoing) study data from 42 healthy subjects given single dose and 18 hemophilia A patients given multiple doses were used for the analysis. A population PK (PopPK) model was developed to predict the plasma ACE910 concentration of each patient. Bleeding events observed during the 6 months prior to study and after the start of ACE910 treatment in patients were applied to the RTTE modeling. Simulations were performed to determine the minimal dose expected to achieve zero bleeds in ≥50% of patients for one year. All analyses were conducted using NONMEM. RESULTS: A linear one-compartment model with first-order absorption was employed as the PopPK model. RTTE model adequately predicted the bleeding onset over time both before and after the start of ACE910 treatment as a function of ACE910 concentration. Simulations suggested that ACE910 concentrations of ≥45 μg/mL should achieve zero bleeds in ≥50% of patients for one year. A weekly SC dose of 1.5 mg/kg was identified as the minimal dose expected to provide a median steady-state trough level of≥45 μg/mL. CONCLUSION: RTTE modeling was useful to quantitatively describe the concentration-dependent prophylactic efficacy of ACE910 on bleeding event and to guide the dose selection for future clinical studies.",0
https://doi.org/10.1080/19420862.2019.1605270,An<i>in vitro</i>FcRn- dependent transcytosis assay as a screening tool for predictive assessment of nonspecific clearance of antibody therapeutics in humans,"A cell-based assay employing Madin-Darby canine kidney cells stably expressing human neonatal Fc receptor (FcRn) heavy chain and β2-microglobulin genes was developed to measure transcytosis of monoclonal antibodies (mAbs) under conditions relevant to the FcRn-mediated immunoglobulin G (IgG) salvage pathway. The FcRn-dependent transcytosis assay is modeled to reflect combined effects of nonspecific interactions between mAbs and cells, cellular uptake via pinocytosis, pH-dependent interactions with FcRn, and dynamics of intracellular trafficking and sorting mechanisms. Evaluation of 53 mAbs, including 30 marketed mAb drugs, revealed a notable correlation between the transcytosis readouts and clearance in humans. FcRn was required to promote efficient transcytosis of mAbs and contributed directly to the observed correlation. Furthermore, the transcytosis assay correctly predicted rank order of clearance of glycosylation and Fv charge variants of Fc-containing proteins. These results strongly support the utility of this assay as a cost-effective and animal-sparing screening tool for evaluation of mAb-based drug candidates during lead selection, optimization, and process development for desired pharmacokinetic properties.",0
