doi,title,abstract,label_included
https://doi.org/10.1182/blood.v130.suppl_1.3668.3668,Use of Bypassing Agents Prior to and Post Bypassing Agent Dosing Guidance during Emicizumab Prophylaxis: Analyses from the HAVEN 1 Study,"Introduction: Emicizumab, A bispecific humanized monoclonal antibody in development for the management of patients (pts) with hemophilia A (PwHA) with/without inhibitors, is administered subcutaneously and facilitates effective hemostasis by bridging FIXa and FX to restore the function of missing FVIIIa. In the multicenter, randomized, phase 3 HAVEN 1 study (NCT0262232) in PwHA with inhibitors aged ≥12 yr, emicizumab prophylaxis vs no prophylaxis significantly reduced annualized bleeding rate (ABR; treated bleeds) by 87% (P<0.001), with 62.9% vs 5.6% of pts, respectively, experiencing zero treated bleeds (Oldenburg et al. NEJM 2017; July 10: epub). In intra-individual comparisons in pts who had previously participated in A prospective, non-interventional study (NCT02476942), emicizumab prophylaxis vs prior episodic and prophylactic bypassing agent (BPA) treatment significantly (P<0.001) reduced ABR by 79% and 92%, respectively (Oldenburg et al. 2017). During the study, serious thrombotic and thrombotic microangiopathy (TMA) events were reported in 5 pts, and were associated with aPCC doses >100 U/kg/day given for ≥24 hr for treatment of breakthrough bleeds (BTBs) during emicizumab prophylaxis; no events were reported when emicizumab was given alone, or in conjunction with rFVIIa alone (Oldenburg et al. 2017). To mitigate further risk of such events, the sponsor implemented dosing guidance to study investigators for BPA use during emicizumab prophylaxis. We describe treatment of BTBs in HAVEN 1 prior to and following BPA dosing guidance during emicizumab prophylaxis. Methods: At the onset of HAVEN 1, pts were instructed to treat BTBs with BPAs according to standard of care, based on the emicizumab safety profile seen in the Phase 1/2 study. With the emerging TMA and thrombotic events, guidance provided on BPA use during emicizumab prophylaxis advised caution with using rFVIIa; it was recommended that BTBs preferably be treated with the lowest rFVIIa dose expected to achieve hemostasis, using ≤90 μ g/kg/day as the initial dose. Pts/investigators were advised to avoid the use of aPCC. If aPCC was the only available BPA, use of the lowest dose expected to achieve hemostasis was advised. Also, local and central laboratory assessments were recommended to monitor for the risk of TMA or thromboembolic (TE) events. Results: Median (range) emicizumab exposure was comparable for pre-(167.0 [20-334] wk) and post-(168.3 [28-186] wk) dosing guidance for BPA use periods. There were 63 aPCC treatment episodes in 18 pts pre-dosing guidance, and 15 aPCC treatment episodes in 6 pts post-dosing guidance (Figure 1). Prior to BPA dosing guidance, the majority of aPCC treatment episodes (44 [69.8%]) were ≤100 U/kg/day and consistent with 1 injection only; 43 (68.3%) were ≤24 hr. Of 19 (30.2%) treatment episodes >100 U/kg/day, 7 (11.1%) were ≥24 hr; 4 treatment episodes were associated with the reported TMA/thrombotic events (Figure 1). Post-dosing guidance, there were 6 (40.0%) treatment episodes <50 U/kg/day and 7 (46.7%) treatment episodes 50-100 U/kg/day, the majority for ≤24 hr. Of 2 (13.3%) treatment episodes that were >100 U/kg/day, 1 episode was ≥24 hr; this pt subsequently experienced A TMA event. The 5 treatment episodes associated with TMA/thrombotic events are shown in Figure 1. There were 91 rFVIIa treatment episodes in 28 pts pre-dosing guidance, and 49 treatment episodes in 19 pts post-dosing guidance (Figure 2). Pre-dosing guidance, the majority (43 [87.7%]) of rFVIIa treatment episodes were ≤270 μ g/kg/day for ≤24 hr. Pre-dosing guidance, 23 (25.3%) treatment episodes were >270 μ g/kg/day. Post-dosing guidance, 37 (75.5%) treatment episodes were ≤180 μ g/kg/day, with only 1 >24 hr in duration. Laboratory data from plasma samples collected subsequent to BPA dosing will be presented. Conclusion: Dosing guidance implemented for BPA treatment during emicizumab prophylaxis with the emerging events of TMA/thrombosis in the HAVEN 1 study led to A decrease in the number of pts who used aPCC, with most sw tching to rFVIIa. Following dosing guidance, lower doses of aPCC and rFVIIa were used to treat BTBs effectively in pts on emicizumab prophylaxis; further TMA/TE events were successfully mitigated in pts who adhered to the guidelines. aPCC doses lower than the maximum dose within A 24-hr interval included in the prescribing information are advised when administered during emicizumab prophylaxis.",0
,Discordance of anti-ischemic and hemodynamic effects of captopril in stable coronary artery disease.,"The role of angiotensin converting enzyme (ACE) inhibition in patients with coronary artery disease without concomitant disease such as heart failure or hypertension has not been elucidated. In this double-blind, cross-over, randomized trial of the ACE inhibitor captopril, its antianginal and anti-ischemic effects were studied during monotherapy and in the presence of an organic nitrate.Thirty-seven patients (34 men, three women) with stable coronary artery disease and exercise-induced ST-segment depression were enrolled. After a washout phase without medication they received placebo, isosorbide dinitrate (ISDN) 20 mg twice daily, captopril 12.5 mg twice daily, and the combination of both for 1 week each, after which exercise tolerance, blood pressure and heart rate (supine, standing and 24 h profile), and peripheral arterial vasodilatation (finger pulse plethysmography) were assessed.Thirty-three patients completed all phases of the study. Exercise-induced anginal symptoms occurred in 17 patients, and asymptomatic ischemia was seen in the other 16 men. In comparison with ISDN, the anti-ischemic effects of captopril were minimal, despite a similar reduction in blood pressure. Compared with baseline, 1 week of placebo reduced the sum of ST-segment depression, the main efficacy parameter, by 10% (NS), captopril by 19% (NS), ISDN by 37% (P < 0.001) and the combination of captopril and ISDN by 42% (P < 0.001; NS versus ISDN). No patient remained completely free of exercise-induced angina during treatment with captopril; however, three patients after ISDN and seven patients after the combination did (P < 0.05). Blood pressure at rest decreased at peak effect by 9-10% systolic (P < 0.001) with monotherapy and by up to 7% diastolic (P < 0.001), and during combined therapy with captopril and ISDN by 18% systolic (P < 0.001) and 12% diastolic (P < 0.001). Significantly enhanced circulatory effects of captopril plus ISDN versus ISDN were found for blood pressure (P < 0.001) and peripheral arterial vasodilation (P < 0.01). The reflex tachycardia induced by ISDN in the upright position (5 beats/min) was not blocked by captopril during combined therapy.The antianginal and anti-ischemic effects of captopril alone were marginal, despite significant circulatory effects after short-term administration. Although captopril in combination with ISDN resulted in a significant further blood-pressure-lowering effect and increased peripheral arterial vasodilatation, the magnitude of potentiation of the anti-ischemic nitrate effects was, in contrast, small. Only exercise-induced angina was further improved by the use of the combination. No paradoxical worsening of ischemia or angina was seen after captopril. Thus, although captopril has no place as first-line therapy for ischemia, its use in combination with ISDN could be advantageous for long-term prognosis.",0
https://doi.org/10.1182/blood-2018-99-118379,Assessment of Emicizumab-Driven Clot Stability in Hemophilia a Model,"Abstract Clot stability is an important hemostatic aspect in treating patients with hemophilia A (HA). Effects of factor VIII (FVIII), recombinant activated FVII (rFVIIa), FXIII and tranexamic acid on clot stability in hemophilia had been reported1). Emicizumab (Emi), FVIIIa-mimicking bispecific antibody, is a recently approved novel therapeutics for HA with inhibitor. Although hemostatic activity of Emi was confirmed by preclinical and clinical studies, whether Emi-driven clot stability is similar to that of FVIII or not remains unknown. Furthermore, in clinical trial of Emi, thrombotic events were reported when high doses of activated prothrombin complex concentrates (aPCC) were used concurrently with Emi. Effect of aPCC on clot stability and its possible association with the thrombotic events should be also clarified. In this study, we investigated the effect of Emi on clot stability with a thromboelastometry (ROTEM) -based assay using tissue plasminogen activator (tPA) as a fibrinolysis trigger, and compared it with that of FVIII or bypassing agents (BPAs). Furthermore, we assessed the effect of BPAs on Emi-driven clot stability. Normal blood from healthy volunteer (n=22) was incubated with anti-FVIII antibody (FVIII:C &lt;1 IU/dL), which was regarded as HA model blood. HA model blood was spiked with Emi (50 μg/ml), rFVIIa (22 nM), and aPCC (1 U/ml). ROTEM was performed with/without tPA (2 nM). We used ellagic acid (Elg, x300 INTEM®) as a trigger in addition to tissue factor (TF, 0.5 pM) since TF-trigger was not sensitive to Emi. Residual area under the curve in 30 min (%AR30) was used as a clot stability parameter. Median values (25-75%tile) of %AR30 were compared among the groups with Dunn's multiple comparison test [*p&lt;0.05, **p&lt;0.01, ***p&lt;0.001]. In Elg-trigger ROTEM, %AR30 of HA model blood had no values since coagulation did not occur within test time. However, coagulation was improved in HA model spiked with Emi and its clot stability showed slightly weak value with no statistical significance [50% (30-76), p&gt;0.05] compared to normal blood [75% (56-90)]. Whilst, HA model + rFVIIa [13%*** (7-22)] and HA model + aPCC [41%*** (20-71)] showed significantly weak values, indicating that effect of Emi on clot stability was comparable to normal blood and better than BPAs in Elg trigger. Concomitant effect of Emi and BPAs were evaluated. Compared to HA model + Emi [50% (30-76)], clot stability increased in the co-presence of Emi and aPCC [99%*** (96-101)] but not in that of Emi and rFVIIa [53% (29-78)]. TF trigger, which was sensitive to BPAs but not to Emi, was also used in order to evaluate concomitant effect of Emi and BPAs. In TF trigger, clot stability of HA model blood + Emi [31% (19-47)] was similar to that of HA mode blood [27% (20-44)] or normal blood [32% (22-55)], but increased in HA model + rFVIIa [43%** (30-62)] and HA model + aPCC [41%** (29-68)]. rFVIIa increased clot stability of HA model blood in the presence of Emi [56%** (28-65)] more than its absence. Effect of the aPCC in the presence of Emi [87%*** (78-91)] was much more remarkable than that of rFVIIa. In conclusion, effect of Emi on clot stability in HA model blood was comparable to that of normal blood, indicating that clot formation under Emi had no qualitative difference with FVIII. Clot stability remarkably increased in Emi in the presence of aPCC, suggesting that hyper clot stability might be one of the reasons of thrombotic events in the concomitant use of Emi and aPCC. 1) Tran HT, et al. Tranexamic acid as adjunct therapy to bypassing agents in haemophilia A patients with inhibitors. Haemophilia. 2014 May;20(3):369-75. Disclosures Ogiwara: CSL Behring: Research Funding. Nogami:Chugai Pharmaceutical Co., Ltd: Consultancy, Membership on an entity's Board of Directors or advisory committees, Patents &amp; Royalties: Anti-FIXa/X bispecific antibodies , Research Funding, Speakers Bureau. Kitazawa:Chugai Pharmaceutical Co., Ltd: Employment, Equity Ownership, Patents &amp; Royalties: Patents related to emicizumab. Shima:F. Hoffmann-La Roche Ltd: Membership on an entity's Board of Directors or advisory committees; Chugai Pharmaceutical Co., Ltd: Consultancy, Membership on an entity's Board of Directors or advisory committees, Patents &amp; Royalties: Anti-FIXa/X bispecific antibodies , Research Funding, Speakers Bureau.",0
https://doi.org/10.1056/nejmoa1703068,Emicizumab Prophylaxis in Hemophilia A with Inhibitors,"Emicizumab (ACE910) bridges activated factor IX and factor X to restore the function of activated factor VIII, which is deficient in persons with hemophilia A. This phase 3, multicenter trial assessed once-weekly subcutaneous emicizumab prophylaxis in persons with hemophilia A with factor VIII inhibitors.We enrolled participants who were 12 years of age or older. Those who had previously received episodic treatment with bypassing agents were randomly assigned in a 2:1 ratio to emicizumab prophylaxis (group A) or no prophylaxis (group B). The primary end point was the difference in bleeding rates between group A and group B. Participants who had previously received prophylactic treatment with bypassing agents received emicizumab prophylaxis in group C.A total of 109 male participants with hemophilia A with inhibitors were enrolled. The annualized bleeding rate was 2.9 events (95% confidence interval [CI], 1.7 to 5.0) among participants who were randomly assigned to emicizumab prophylaxis (group A, 35 participants) versus 23.3 events (95% CI, 12.3 to 43.9) among those assigned to no prophylaxis (group B, 18 participants), representing a significant difference of 87% in favor of emicizumab prophylaxis (P<0.001). A total of 22 participants in group A (63%) had zero bleeding events, as compared with 1 participant (6%) in group B. Among 24 participants in group C who had participated in a noninterventional study, emicizumab prophylaxis resulted in a bleeding rate that was significantly lower by 79% than the rate with previous bypassing-agent prophylaxis (P<0.001). Overall, 198 adverse events were reported in 103 participants receiving emicizumab prophylaxis; the most frequent events were injection-site reactions (in 15% of participants). Thrombotic microangiopathy and thrombosis were reported in 2 participants each (in the primary analysis) who had received multiple infusions of activated prothrombin complex concentrate for breakthrough bleeding. No antidrug antibodies were detected.Emicizumab prophylaxis was associated with a significantly lower rate of bleeding events than no prophylaxis among participants with hemophilia A with inhibitors. (Funded by F. Hoffmann-La Roche and Chugai Pharmaceutical; HAVEN 1 ClinicalTrials.gov number, NCT02622321 .).",1
https://doi.org/10.1097/mbc.0000000000000823,Prophylactic treatment in hemophilic patients with inhibitors,": The development of inhibitors continues to be the most important complication in severe hemophilia A. The management of inhibitor patients revolves around two basic principles: eradication of the inhibitor and management and prevention of bleeding. In this paper, we review the prophylactic treatments carried out in the last two decades with the two available bypassing agents and the results of the clinical trials carried out with the new molecules under investigation or already licensed for the prevention of hemorrhagic episodes in hemophilia, like emicizumab.",0
https://doi.org/10.1182/blood-2018-99-113623,A Novel Point-of-Care Whole Blood Coagulation Assay to Monitor Emicizumab Therapy in Patients with Hemophilia,"Abstract Introduction: Emicizumab is a humanized, bispecific antibody against activated Factor IX (FIX/IXa) and FX/Xa that mimics the cofactor function of activated FVIII (FVIIIa) by spatially relocating FIXa and FX to the appropriate position in the tenase complex. Though the bleeding rate in patients on emicizumab is remarkably reduced, hemostatic monitoring is important in the event of breakthrough bleeding, development of anti-drug antibodies, and for surgery. An APTT is markedly shortened in the presence of small amounts of emicizumab, and, hence not useful. The thrombin generation assay (TGA), thromboelastometry, and clot waveform analysis measure the hemostatic effect of emicizumab, both in vivo and ex vivo. However, these assays are time-consuming, need expert interpretation, and not widely available. We have developed a novel, point-of-care, whole blood assay based on a dielectric microsensor (ClotChip) that can obtain global blood coagulation assessment in a miniaturized, portable measurement platform. The aim of this study was to assess the sensitivity of ClotChip to detect the addition of variable concentrations of emicizumab ex vivo into hemophilic whole blood and the feasibility of monitoring emicizumab therapy in vivo using ClotChip . Methods: After IRB approval, patients accrued for the study were adults with severe hemophilia A with inhibitors starting emicizumab therapy (n=2), and a child with severe hemophilia A without inhibitors (n=1). Blood samples were obtained by venipuncture into collection tubes containing 3.2% sodium citrate anticoagulant. Samples were collected both prior to (n=2), and at time points of 30 min (n=1), 1 hour (n=1), 1 week 1 (n=1), and 8 weeks (n=1) after initiation of emicizumab therapy. Whole blood samples from hemophilia patients not on emicizumab were spiked with different concentrations of emicizumab, with and without the addition of replacement therapy. Whole blood samples were then tested with the ClotChip. Coagulation was induced with CaCl2 addition. ClotChip is based on the electrical technique of dielectric spectroscopy (DS) integrated into a low-cost (material cost &lt; $1), small- sized (26mm × 9mm × 3mm), and disposable microfluidic biochip with miniscule sample volume (&lt; 10 µL). ClotChip curves were calculated as blood permittivity at 1MHz, and the time to reach a peak in permittivity (TpeakFig 1A) was taken as an indication of coagulation time. TGA using low tissue factor concentration was also performed on blood samples according to the manufacturer's direction. Results: We observed a decrease in the ClotChip Tpeak parameter for post-therapy samples (30 min and 1 hr.) compared to baseline (pre-therapy) for hemophilia patients with inhibitors on emicizumab therapy (Fig 1B). A time-dependent decrease was observed in ClotChipTpeak after emicizumab administration with week 1 and 8 samples showing normal values. Ex vivo spiking with emicizumab in blood from patients with hemophilia with and without inhibitors showed a concentration dependent decrease in ClotChip Tpeak parameter (Fig 1C). Addition of rFVIII or rFIX in emicizumab-spiked blood from the patient without inhibitors further decreased ClotChipTpeak in a concentration dependent manner (Fig 1D). Similarly, addition of rFVIII to the emicizumab spiked blood from the inhibitor patient further decreased ClotChip Tpeak compared to emicizumab alone (Fig 1E). ClotChip Tpeak exhibited strong negative correlation with ETP (rs = 0.81, Fig 1F) and peak thrombin (rs = -0.82) from TGA assays. Conclusions: Our studies demonstrate the feasibility of monitoring emicizumab therapy in patients with hemophilia with and without inhibitors, using a novel, microfluidic, dielectric sensor (ClotChip), allowing whole blood assessment of hemostasis in a single disposable sensor. ClotChip has potential to fulfill an unmet clinical need to assess global coagulation potential in hemophilia patients on emicizumab therapy, especially when additional hemostatic therapy is needed for treatment of breakthrough bleeds. Additional spiking studies to assess the addition of bypassing agents (rFVII or FEIBA) to blood from emicizumab-treated patients are underway. Disclosures Suster: Case Western Reserve University: Patents &amp; Royalties: licensed to XaTek, Inc.; XaTek, Inc.: Consultancy. Maji:Case Western Reserve University: Patents &amp; Royalties: Licensed to XaTek, Inc. . Schmaier:Temple University: Patents &amp; Royalties; Shire: Consultancy, Honoraria, Research Funding; Enzyme Research Laboratories: Honoraria; Cleveland Clinic Foundation: Research Funding; Alnylam: Research Funding; Biomotiv: Consultancy. Mohseni:Case Western Reserve University: Patents &amp; Royalties: Licensed to XaTek, Inc.; XaTek, Inc.: Consultancy. Ahuja:Shire: Honoraria, Speakers Bureau; Bayer: Honoraria; Bioverativ: Honoraria, Speakers Bureau.",0
https://doi.org/10.1182/blood-2019-125364,"Beliefs, Opinions, and Impact of Emicizumab on Hemophilia Patients: A National U.S. Survey","Introduction : As the first in a new class of substitutive, non-factor hemophilia A therapy, acceptance of emicizumab by patients with hemophilia is unclear. Impact of emicizumab on treatment adherence, pursuit of athletic activity, psychosocial connection to the hemophilia patient community, and patient satisfaction have not been assessed. Additionally, reasons for choosing to initiate or not initiate emicizumab in patients who have been offered it have not been evaluated. This patient survey study addresses these questions. Methods : A voluntary, anonymous 22-item survey was electronically distributed to hemophilia patients throughout the United States through hemophilia treatment centers and the National Hemophilia Foundation. Recipients were instructed to take the survey only if they were a patient with hemophilia A who has been offered bleeding prophylaxis (or the parent of such a patient under age 18). Skip logic was employed such that individual respondents answered 15 or fewer items based on their familiarity with and use of emicizumab. Results to items utilizing a 5-point Likert scale were converted to weighted average scores (ranging from 1, lowest to 5, highest) for comparison between groups of respondents. Results : 126 respondents (67 adults and 59 parents of children age &lt;18) answered the survey, 82% without an inhibitor and 18% who currently have an inhibitor (Table 1). 89% of respondents were familiar with emicizumab, of whom 43% were using and 57% had never used emicizumab. Table 1 describes respondent demographics and baseline bleeding and prophylaxis characteristics by emicizumab use and inhibitor status. Patients using emicizumab had higher reported median annualized bleeding rates (ABR) prior to emicizumab than those not using emicizumab regardless of inhibitor status (5 bleeds/year vs. 2 bleeds/year) and patients using emicizumab reported lower adherence with prior factor prophylaxis than current emicizumab prophylaxis (76.7% vs. 96.8 described adherence as good or excellent). Non-inhibitor patients emphasized subcutaneous administration [score 4.33, 21% cited as most important reason (MIR) for initiating emicizumab] and ability to dose ≤1 time per week (4.24, 6%) as equally or more important than safety (4.27, 15%) and effectiveness in bleed prevention (4.15, 24%), Table 2. By contrast, the top concern of inhibitor patients was effectiveness in bleed prevention (4.27, 46%) and safety (4.18, 9%), with lifestyle concerns such as subcutaneous administration (3.82, 0%) less important. In consideration of the impact of emicizumab on wellbeing, most patients were highly satisfied with their decision to start emicizumab (Table 3). Emicizumab use did not result in perceived distancing from the hemophilia patient community. Non-inhibitor patients deciding not to initiate emicizumab (Table 4) cited safety concerns (score 4.38, MIR 45%), unknowns of a new treatment (4.22, 33%), and lack of lab monitoring of emicizumab effect (4.10, 15%) as the primary reasons to forego emicizumab; effectiveness (3.35, 0%) was not a major concern. Of the 64 respondents not using emicizumab, 60% had discussed it with their hemophilia doctor; of these patients, 90% chose to wait for more experience with its use and 10% would have started it but could not due to insurance denial. Of the 40% who had not discussed emicizumab with their hemophilia doctor, 67% felt they learned enough about emicizumab from patient groups or marketing and had decided not to begin the agent; 33% felt they did not have enough information to make a decision about using it. Conclusions : Most U.S. hemophilia A patients requiring prophylaxis are familiar with emicizumab. Regardless of inhibitor status, patients with higher ABR and worse compliance with infusion-based prophylaxis are more likely to use emicizumab. From the non-inhibitor patient perspective, ease of administration with subcutaneous dosing ≤1 time per week was at least as important as effectiveness and safety of the drug in their decision to switch to emicizumab, whereas this was much less important to inhibitor patients. Patients using emicizumab were highly satisfied with their decision to switch to this agent. Patients choosing not to switch to emicizumab are concerned about safety, unknowns with a new treatment, and lack of lab monitoring, although one-third of patients felt they lacked the information to decide whether to use it. Disclosures Al-Samkari: Dova: Consultancy, Research Funding; Agios: Consultancy, Research Funding; Moderna: Consultancy. Croteau:Octapharma: Honoraria; Bayer: Consultancy, Honoraria; Pfizer: Research Funding; Genentech: Consultancy, Honoraria; Spark Therapeutics: Research Funding; CSL Behring: Consultancy, Honoraria; Shire: Consultancy, Honoraria; Novo Nordisk: Consultancy, Honoraria, Research Funding.",0
