doi,title,abstract,label_included
https://doi.org/10.1007/s40495-017-0090-5,Pharmacokinetics of Bispecific Antibody,"Purpose of Review: This article provides a brief overview of bispecific antibody (BsAb) mechanisms of action, structures, and pharmacokinetic (PK) properties, including absorption, distribution, and elimination. Recent trend in BsAb development is also introduced from a PK perspective. Recent Findings: Advances in biotechnology have led to the development of diverse BsAb formats, which provide a wide range of options to tailor the design of BsAbs to match the proposed mechanisms of action and to optimize the intended therapies. Understanding the PK properties of BsAbs and the important factors influencing PK is critical for the rationale design and development of BsAb therapeutics. PK behavior of a BsAb is dependent on its format and could be governed by molecular weight, physicochemical properties, interaction with Fc receptors, and binding to target, etc. Due to their multi-binding properties, BsAbs may have superior target tissue deliveries (e.g., brain, solid tumors) and additional unique PK properties compared to conventional mAbs, which may offer therapeutic advantages. Despite the many unknowns about BsAb disposition, it is generally believed that an ideal BsAb should have a balance between favorable systemic exposure (typically a long half-life is preferred) and appropriate distribution and tissue penetration. Summary: BsAb has unique mechanisms of action, structures, and PK properties when compared to conventional monoclonal antibody (mAb) and also shares similar pathways that contribute to PK characteristics of conventional mAb. Understanding the PK of BsAbs and the important factors influencing the PK is critical for the rationale design and development of BsAb therapeutics.",0
https://doi.org/10.1542/peds.2019-3128,Pediatric Orphan Drug Indications: 2010–2018,"BACKGROUND: Orphan drug development is crucial for children, who are disproportionately affected by rare diseases. Data are lacking on the number, nature, and benefit of recently approved pediatric orphan indications. METHODS: We classified the 402 orphan indications the US Food and Drug Administration approved between 2010 and 2018 as “pediatric” if they were approved for children only or targeted pediatric diseases. We determined the number of unique diseases targeted by pediatric orphan indications and calculated the proportion that were for (1) novel drugs, (2) non-novel drugs approved to treat ≥1 common disease, and (3) non-novel drugs approved only to treat rare diseases. Among pediatric orphan indications eligible for US Food and Drug Administration breakthrough designation (granted to drugs potentially representing major therapeutic advances), we calculated the proportion receiving this designation. RESULTS: Of the 402 orphan indications, 136 (33.8%) were pediatric. These 136 indications targeted 87 unique diseases; 21 diseases were targeted by ≥1 indication. Of the 136 pediatric orphan indications, 60 (44.1%) were for novel drugs, 45 (33.1%) were for non-novel drugs approved to treat ≥1 common disease, and 31 (22.8%) were for non-novel drugs approved only to treat rare diseases. Among 97 indications eligible for breakthrough designation, 20 (20.6%) received this designation. CONCLUSIONS: Recent orphan drug development has increased the availability of treatments for pediatric rare diseases. Most pediatric orphan indications expanded use of existing drugs, and many targeted the same disease. Some indications may represent breakthroughs, but substantial unmet need for treatments remains for most pediatric rare diseases.",0
https://doi.org/10.1055/s-0039-1680182,Emicizumab Prophylaxis Administered Once-weekly or Every Two Weeks Provides Effective Bleed Prevention in Persons with Hemophilia A (PwHA) without Inhibitors - Results from the Phase III HAVEN 3 Study,"Objectives: Subcutaneous once-weekly (QW) prophylaxis with emicizumab - a bispecific humanized monoclonal antibody -is effective in PwHA with inhibitors. The HAVEN 3 (NCT02847637) study was designed to assess the efficacy, safety, and pharmacokinetics (PK) of emicizumab prophylaxis QW and every 2 weeks (Q2W) in adolescent/adult PwHA without inhibitors. Methods: Severe haemophilia A patients without inhibitors aged >12 years were enrolled. Patients on prior episodic FVIII, with >5 bleeds over the previous 24 weeks, were randomized (2:2:1) to emicizumab prophylaxis: 3 mg/kg QW for 4 weeks, followed by 1.5 mg/kg QW (Arm A) or 3 mg/kg Q2W (Arm B) maintenance; or to no prophylaxis (Arm C). The primary efficacy objective compared treated bleed rates (Arm A vs C; Arm B vs C). Patients previously on FVIII prophylaxis received 1.5 mg/kg QW emicizumab maintenance in Arm D; those from a non-interventional study (NIS; NCT02476942) were included in intra-individual comparisons. Results: Overall, 152 patients aged 13-77 years (median: 38) were enrolled. Statistically significant and clinically meaningful reductions of >94% were observed in treated, all, treated spontaneous, joint and target joint bleeds with emicizumab QW or Q2W versus no prophylaxis (ITable 11): >55% of patients receiving emicizumab QW or Q2W had zero treated bleeds and >91% had <3 treated bleeds. An intra-individual comparison showed a 68% reduction in treated bleed rate with QW emicizumab versus prior FVIII prophylaxis observed during the NIS (ITable 11). Emicizumab was well tolerated; the most common AE was injection-site reaction (25%). As of the clinical cut-off date of 15 September, 2017, no thrombotic events, ADAs or de novo FVIII inhibitors had occurred. Sustained emicizumab trough concentrations were achieved with both regimens. Conclusions: Emicizumab prophylaxis QW or Q2W significantly reduced bleed rates in PwHA without inhibitors, with a favourable safety profile. Most notably, an intra-individual comparison demonstrated superiority of emicizumab over previous FVIII prophylaxis. Subcutaneous emicizumab prophylaxis could provide a highly efficacious and flexible management option, with reduced treatment burden for PwHA without inhibitors. (Table Presented).",0
https://doi.org/10.1358/dof.2016.041.11.2555983,"Emicizumab. Anti-factor IXa and X monoclonal antibody, Treatment of congenital FVIII deficiency (hemophilia A)","Hemophilia is an inherited clotting disorder in which spontaneous and prolonged bleeding can appear at any location. Hemophilia A is caused by the inheritance of an abnormal form of factor VIII (FVIII). Emicizumab is a humanized, monoclonal modified antibody designed to replace the function of FVIII by bringing activated factor IX (FIXa) and factor X (FX) into a suitable way to facilitate rapid conversion of FX to activated FX (FXa). In animal primate models of hemophilia A, emicizumab showed hemostatic effects. In severe hemophilia A patients with or without FVIII inhibitors, emicizumab once weekly s.c. is well tolerated and decreased the annualized bleeding rate in all patients. Currently, three phase III studies are ongoing to assess the efficacy, safety and pharmacokinetics of s.c. emicizumab in severe hemophilia A patients. The product has been granted orphan drug designation (Europe, U.S. and Japan). In addition, emicizumab received breakthrough therapy designation by the U.S. Food and Drug Administration (FDA), and priority review status by the Japanese authorities for the treatment of hemophilia A.",0
https://doi.org/10.1182/blood-2018-99-119270,The Complete Dependence of Factor IX Padua (R338L) Hyperactivity on Factor VIIIa Cofactor Activity Supports Its Safety As a Transgene for Hemophilia B Gene Therapy,"Abstract Factor IX (FIX) Padua (R338L) has been described as a game changer for hemophilia B (HB) gene therapy. The ~8-fold increased specific activity compared to wild-type FIX (FIX WT) in aPTT-based clotting assay has recently allowed for a lowering of adeno-associated virus (AAV) vector dose compared to earlier gene therapy trials using FIX WT, while still achieving sustained near-curative FIX activity levels. The lowered AAV vector dose mitigated the vector dose-dependent hepatotoxicity, which had remained a major safety and efficacy limitation for AAV gene therapy. To date, at least 2 pivotal phase III gene therapy trials for HB using AAV FIX Padua are planned. Despite this enthusiasm, the underlying molecular mechanism of the hyperactivity of FIX Padua is undefined. As such, the safety concerns of unregulated FIX activity and the potential for ensuing thrombotic complications have not been fully addressed. Indeed, recent thrombotic complications in non-gene therapy hemophilia clinical trials evaluating non-factor therapies that promote hemostasis by circumventing regulatory interactions should engender caution. Activated FVIII (FVIIIa) is essential for the biological activity of activated FIX (FIXa), which provides an important regulatory requirement. To determine the role of FVIIIa in the hyperactivity of FIX Padua, we measured the relative specific activity of FIX Padua compared to WT in HB plasma using a unique reagent, ACE910. ACE910 is a bispecific antibody that sufficiently brings together FIXa and its substrate, FX, to efficiently promote hemostasis, even in the absence of FVIIIa molecules. It has been described as a ""FVIII-mimetic"" and is currently approved as a bypassing agent for hemophilia A patients with FVIII inhibitors. In our assays, plasma FVIII activity is inhibited to &lt;1% normal activity with a cocktail of monoclonal anti-FVIII antibodies. In unadulterated HB plasma, recombinant zymogen FIX Padua has a ~8-fold higher clotting activity compared to FIX WT (Fig). However, when FVIIIa is replaced by ACE910, FIX Padua and WT have comparable clotting activities (Fig). Similarly, we observe that the hyperactivity of activated FIX Padua compared to WT in a clotting assay is completely abrogated by replacing FVIIIa with ACE910. These results suggest that the enhanced clotting activity of FIX(a) Padua compared to FIX(a) WT is wholly dependent on FVIIIa cofactor activity. We also measured the ability of recombinant FIX(a) Padua and WT to restore thrombin production to HB plasma in a thrombin generation assay (TGA). We observe that the EC50 of thrombin generation in HB plasma of zymogen and activated FIX Padua is ~8-fold lower than for FIX(a) WT. However, when FVIIIa is replaced with ACE910, FIX(a) Padua and WT demonstrate comparable EC50s of thrombin generation. Importantly, we observe no difference in the binding of FIXa Padua and FIXa WT with ACE910 in enzyme kinetic studies; this was expected because FIXa Padua and WT have an identical ACE910 binding site in their EGF-domain. Combined, these results demonstrate that the ~8 fold hyperactivity of FIX(a) Padua compared to FIX(a) WT in plasma assays requires FVIIIa cofactor activity. Consistent with this mechanism, we have previously observed in reconstituted systems that FIX(a) Padua and WT have comparable rates of activation by FXIa and inactivation by antithrombin. This result suggests that FIX Padua and WT are regulated similarly, supporting the safety of FIX Padua as a transgene. Enzyme kinetic studies of FIXa Padua and WT without FVIIIa demonstrate similar rates of FX activation, while FIXa Padua demonstrates increased rates of FX activation with FVIIIa compared to FIXa WT. We conclude, therefore, the mechanism of the increased specific activity of FIX(a) Padua is wholly dependent on its enhanced interaction with its cofactor FVIIIa. This enhancement is essential for the increased activity observed in both reconstituted and plasma-based assays. Moreover, the augmented interaction of FIX(a) Padua with FVIIIa is sufficient to account for the ~8-fold pro-hemostatic enhancement compared to FIX(a) WT observed in plasma assays. Combined, these results definitively address previously unanswered safety concerns regarding the potential risk of thrombotic complications with the use of FIX Padua transgene. They strongly support the ongoing use of FIX Padua in HB gene therapy. Disclosures Camire: Pfizer: Consultancy, Membership on an entity's Board of Directors or advisory committees, Research Funding; Bayer: Consultancy; Spark Therapeutics: Membership on an entity's Board of Directors or advisory committees.",0
https://doi.org/10.1182/blood-2018-99-116410,Model of the Impact of Delayed Inhibitor Development on Cumulative Breakthrough Bleeds and Costs in Persons with Hemophilia A Receiving Emicizumab Prophylaxis,"Abstract Introduction: Approximately 30% of persons with hemophilia A (PwHA) develop neutralizing inhibitors to factor VIII (FVIII) treatment, with peak inhibitor development estimated to occur at 20-50 FVIII exposure days. Emicizumab is a recombinant factor IXa- and factor X-directed antibody, which is Food and Drug Administration approved for prophylaxis in PwHA with inhibitors and is also being evaluated for the treatment of PwHA without inhibitors. We developed a simulation model to estimate the time to inhibitor development in PwHA receiving emicizumab prophylaxis compared with those receiving FVIII prophylaxis. Methods: We developed a decision tree model using Microsoft Excel to estimate the frequency of breakthrough bleeds (BTBs) and development of inhibitors in severe hemophilia A patients over a 20-year period (starting age of patients: 12 months). Patients in the model were assumed to receive either FVIII or emicizumab as prophylaxis. All patients received FVIII for the treatment of BTBs. BTB rates were obtained from HAVEN trials and published sources. Each day of FVIII infusion, regardless of indication (prophylaxis or bleed treatment) was counted as 1 FVIII exposure day. Patients in either treatment arm could develop inhibitors after 20 exposure days, with the probability of developing inhibitors and the number of exposure days required to develop inhibitors assumed to be the same in both arms. However, the risk of inhibitor development was assumed to vary by FVIII treatment i.e. plasma-derived or recombinant. Inhibitors could be transient (resolving spontaneously within 6 months) or persistent. Patients who developed persistent inhibitors could undergo immune tolerance induction (ITI) and, if unsuccessful, switch to prophylaxis and BTB treatment with bypassing agents (BPAs; activated prothrombin complex concentrate [aPCC] for prophylaxis and recombinant activated factor VII [rFVIIa] or aPCC for bleed treatment) in the FVIII arm, and prophylaxis with emicizumab and BTB treatment with BPAs (rFVIIa or aPCC) in the emicizumab arm, without additional ITI attempts. Patients who resolved their inhibitors were assumed not to regain them during the model time horizon. Treatment costs were calculated using drug unit list price (FVIII short acting, emicizumab, rFVIIa and aPCC), dosing was obtained from package inserts and other published sources, and body weight by age was obtained from US growth charts. Key model outcomes included the time to inhibitor development, the total number of BTBs, and total drug costs (in 2018 USD) over the model time horizon. Sensitivity analyses were performed to identify model inputs that were influential on study outcomes, by varying model inputs (±20%). Results: Patients receiving FVIII prophylaxis were estimated to reach 20 FVIII exposure days in 4 months, compared with 162 months in patients receiving emicizumab prophylaxis. The total number of estimated BTBs per patient over 1 year was 1.5 and 5.0; over 5 years, 7.5 and 26.8; and over 20 years, 32.3 and 108.9 in the emicizumab and FVIII arms, respectively. The associated cost savings were estimated at $1.7 million over 20 years for each severe hemophilia A patient initiating emicizumab prophylaxis compared with FVIII prophylaxis. The incremental number of bleeds with FVIII compared with emicizumab prophylaxis was most sensitive to the annual number of BTBs with each prophylaxis regimen; however, results consistently showed fewer bleeds with emicizumab prophylaxis. Conclusions: Assuming the same risk of inhibitor development, emicizumab prophylaxis delayed the development of inhibitors by more than 10 years compared with FVIII prophylaxis. The model suggests that prophylaxis with emicizumab compared with FVIII leads to an avoidance of bleeds and considerable healthcare cost savings. Disclosures Sidonio: Uniqure: Honoraria; CSL Behring: Honoraria; Shire: Honoraria, Research Funding; Genentech/Roche: Honoraria, Research Funding; Kedrion/Grifols: Research Funding; Bioverativ: Honoraria, Research Funding; Biomarin: Honoraria; Novo Nordisk: Honoraria. Patel:Genentech Inc: Employment. Corman:Genentech, Inc.: Consultancy. Raimundo:Genentech Inc: Employment, Other: Ownership interests PLC.",0
https://doi.org/10.1111/bjh.16574,Prediction of the haemostatic effects of bypassing therapy using comprehensive coagulation assays in emicizumab prophylaxis‐treated haemophilia A patients with inhibitors,"In emicizumab prophylaxis, the concomitant therapy using bypassing agents (BPAs) is required for breakthrough bleeding and invasive procedures with attention to thrombotic complications. To predict coagulant effects of BPAs in emicizumab-treated patients with haemophilia A (PwHA) with inhibitor (PwHAwI), blood samples from emicizumab-treated PwHAwI (n = 8) and PwHA without inhibitor (n = 2) in phase 1/2 and HAVEN 1 study, spiked with activated prothrombin complex concentrates (aPCC) or recombinant factor VIIa (rFVIIa) ex vivo, and blood samples from emicizumab-treated PwHAwI-receiving BPAs were analysed by Ca2+ -triggered rotational thromboelastometry (ROTEM) and ellagic acid/tissue factor-triggered clot waveform analysis (CWA). Spiked aPCC, corresponded to 10-100 U/kg, markedly shortened ROTEM parameters beyond the normal range, while spiked rFVIIa, corresponded to 90-270 μg/kg, shortened them within near-normal range. Each of the spiked BPA-improved adjusted maximum coagulation velocity of CWA to within or near the normal range. In blood samples at post-infusion of aPCC (44-73 U/kg) or rFVIIa (79-93 μg/kg), the parameters of both assays improved to approximately the normal range. Taken together, ex vivo results of spiking tests in ROTEM and CWA, except aPCC spiking test in ROTEM, were relatively consistent with in vivo ones, and could usefully predict the coagulant effects of concomitant bypassing therapy for emicizumab-treated PwHAwI.",0
https://doi.org/10.12659/ajcr.922326,Utilization of Emicizumab in Acquired Factor VIII Deficiency,"BACKGROUND Acquired hemophilia A (AHA) is a rare autoimmune disease caused by immunoglobulins that bind and inactive factor VIII, thereby predisposing to life-threatening bleeding. Bleeding is typically stabilized by utilizing bypassing agents, such as recombinant factor VIIa (rVIIa). Select case reports have demonstrated the success of alternative prophylaxis for clearance of factor VIII inhibitors through the use of emicizumab, a current FDA approved medication for treatment of congenital hemophilia A. In this case report we present the efficacy of utilizing emicizumab as a prophylactic agent in a patient that was unable to tolerate first-line therapy for prophylaxis. CASE REPORT A 91-year-old male presented for ongoing hematuria for 5 weeks with prior workup unrevealing. He was given a day's course of recombinant factor VIIa to stabilize his bleeding and was started on cyclophosphamide and prednisone after a revealing hematological workup including activated partial thromboplastin time (aPTT) >100 seconds and factor VIII inhibitor level of 44 BU/mL. He continued to require VIIa infusions to control his bleeding and was started on emicizumab once stabilized. His bleeding remained controlled and his inhibitor decreased after 6 months of therapy with repeat factor VIII inhibitor level of 1.9 BU/mL. CONCLUSIONS The success of utilizing emicizumab for bleeding prophylaxis in AHA is demonstrated by this patient's resolution of bleeding. The high frequency of dosing and higher risk for thrombosis with factor VIIa, in conjunction with our patient's medical history and ease of administration, make emicizumab an ideal agent for bleeding prophylaxis while awaiting clearance of factor VIII inhibitors.",0
https://doi.org/10.1111/hae.12400,Abstracts,"Introduction and Objectives: Inhibitor development in nonsevere haemophilia A patients (FVIII:C, 2-40 IU/dL) has a heterogeneous clinical phenotype, ranging from irrelevant transient inhibitors to high titre neutralizing antibodies with severe bleeding complications. Data on inhibitor presentation are scarce and selected, favouring those with severe complications. The aim of current study was to describe the presenting symptoms of inhibitors in a large unselected cohort of nonsevere haemophilia patients. Materials and Methods: Clinical data were collected of 107 inhibitor patients derived from a source population of 2,709 nonsevere haemophilia A patients that were treated between 1980 and 2011 in 34 European and Australian centers (the INSIGHT consortium). Patients were subdivided according to age and calendar period at time of inhibitor development (10-year groups), aiming to search for age-related trends and trends over time. Results: Age at inhibitor detection varied widely between 1 and 85 years with a median age of 38 years (IQR, 15-61). Most inhibitors developed in the period of 2000-2010 (n = 64, 60%). Inhibitors developed after a median of 28 exposure days (IQR, 14-66), which was comparable between all age groups. Fifty-seven patients (56%) had high titre inhibitors (>5 BU/mL). About half of the high titre inhibitors developed in patients older than 40 years (n = 30, 53%) and 60% after the year 2000 (n = 34). In 13 (12%) inhibitor patients the inhibitor was detected during routine laboratory screening and no clinical signs of the inhibitor were present. More than half of the patients (n = 61) had an increased bleeding tendency at presentation with inhibitor. In 80 patients (80%) endogenous FVIII:C was decreased to below 5 IU/dL (including 33/44 patients with low titer inhibitors), of whom FVIII:C fell below ≤ 0.01 IU/mL in 49 patients (46%). Conclusion: Half of the patients with nonsevere haemophilia A and inhibitors developed high titre inhibitors; these were more common in the last decennium. More than half of the patients presented with bleeding complications and 46% had changed to a severe phenotype. These results stress the importance of close follow-up after exposure to therapeutic factor VIII concentrates in nonsevere haemophilia A patients.",0
